{
  "compilation": {
    "activation": "contextual_selection_without_quotas",
    "coordination": "source_scope_and_guardrails_constrain_principles_profiles_and_devices",
    "method": "curated-operational-composition/1",
    "risk_policy": "preserve_qualitative_source_judgments_without_scores_or_automatic_exclusion",
    "semantic_policy": "optional_conceptual_context_never_a_style_rule",
    "status": "compiled_synthesis_not_separately_human_reviewed",
    "validation_limits": "structural_binding_and_lineage_not_semantic_entailment_or_new_human_approval"
  },
  "contextual_profiles": [
    {
      "activation": "Quando il testo spiega concetti scientifici; applicare le regole fisico-matematiche solo nei passaggi pertinenti, non per il solo fatto che il testo sia divulgativo.",
      "device_ids": [
        "D01",
        "D02",
        "D03",
        "D04",
        "D05",
        "D06"
      ],
      "guardrail_ids": [
        "G01",
        "G02",
        "G03",
        "G04",
        "G05",
        "G06",
        "G09",
        "G10"
      ],
      "id": "C01",
      "label": "Divulgazione scientifica",
      "principle_ids": [
        "P01",
        "P02",
        "P03",
        "P04",
        "P06"
      ],
      "rules": [
        {
          "instruction": "Collegare concetto astratto, relazione fisica e bilanciamento dimensionale necessario. Il formalismo ha una funzione esplicativa, non è fine a sé stesso; il modello scelto non equivale alla spiegazione completa della natura fisica. Passare da condizioni costanti a variabili solo se serve all'obiettivo.",
          "source_pattern_ids": [
            "EPC:T0009",
            "EPC:T0014",
            "DPC:T0003",
            "DPC:T0008"
          ],
          "when": "Si impiegano concetti matematici per grandezze o fenomeni fisici."
        },
        {
          "instruction": "La tolleranza dipende dal contesto del problema e non da una scelta personale dell'autore. Non trasferire senza questa distinzione il criterio di sufficienza pratica dei progetti.",
          "source_pattern_ids": [
            "EPC:A0001"
          ],
          "when": "Si valuta l'adeguatezza di un'approssimazione scientifica."
        },
        {
          "instruction": "È un dispositivo privilegiato nella divulgazione, non un'apertura obbligatoria. Precisare le condizioni pertinenti e sviluppare l'analisi; usare il calcolo numerico solo per rendere leggibile un'operazione.",
          "source_pattern_ids": [
            "APC::R0010",
            "APC::R0012"
          ],
          "when": "Uno scenario ipotetico facilita l'avvio del ragionamento."
        }
      ]
    },
    {
      "activation": "Quando il testo presenta un progetto, una configurazione, una soluzione o istruzioni operative; un testo misto può attivare anche il profilo scientifico solo nei suoi passaggi pertinenti.",
      "device_ids": [
        "D01",
        "D02",
        "D05",
        "D06"
      ],
      "guardrail_ids": [
        "G01",
        "G02",
        "G03",
        "G05",
        "G06",
        "G07",
        "G08",
        "G09"
      ],
      "id": "C02",
      "label": "Progetti e tutorial",
      "principle_ids": [
        "P01",
        "P02",
        "P04",
        "P05",
        "P06"
      ],
      "rules": [
        {
          "instruction": "Chiarire il bisogno, la curiosità o la lacuna reale e quale risultato è sufficiente allo scopo. Coordinare semplicità, riuso delle risorse e margini mirati di adattamento, senza trasformarli in richieste di massima flessibilità o ottimizzazione indiscriminata.",
          "source_pattern_ids": [
            "APC::R0013",
            "EPC:A0001",
            "DPC:A0001",
            "DPC:A0002",
            "DPC:T0009"
          ],
          "when": "Si presenta e si motiva una soluzione."
        },
        {
          "instruction": "Valutare alternative concretamente utili e chiarire dipendenza sostituita, condizioni e differenze di risultato. Il rischio di sovrauso è alto: non introdurre obbligatoriamente un'alternativa a ogni dipendenza. Una preferenza di configurazione non diventa un requisito e l'equivalenza tecnica va sostenuta nel caso.",
          "source_pattern_ids": [
            "DPC:T0005",
            "EPC:T0011"
          ],
          "when": "Un tutorial dipende da componenti, servizi o attori esterni."
        },
        {
          "instruction": "Preferire una domanda che il seguito affronta realmente o un calcolo numerico utile. Gli scenari ipotetici sono meno frequenti che nella divulgazione e non sostituiscono istruzioni operative; non importare automaticamente i requisiti formali specifici del profilo scientifico.",
          "source_pattern_ids": [
            "APC::R0003",
            "APC::R0010",
            "APC::R0012"
          ],
          "when": "Si deve rendere leggibile un passaggio operativo o quantitativo."
        }
      ]
    },
    {
      "activation": "Quando occorre dichiarare un'omissione informativa o organizzare una prosecuzione effettivamente pianificata. Il solo tema non implica una serie.",
      "device_ids": [
        "D06"
      ],
      "guardrail_ids": [
        "G01",
        "G02",
        "G05",
        "G06"
      ],
      "id": "C03",
      "label": "Perimetro e prosecuzioni pianificate",
      "principle_ids": [
        "P06"
      ],
      "rules": [
        {
          "instruction": "Nei testi divulgativi, distinguere l'esclusione informativa dal perimetro dalla promessa di sviluppare un contenuto. Per le prosecuzioni pianificate distinguere rinvio interno e articolo successivo: di norma dichiarare prima l'appartenenza a una serie e precisare contenuto, destinazione o tempi solo se definiti. Non rinviare ciò che serve all'obiettivo corrente e non dedurre un sequel da una semplice omissione.",
          "source_pattern_ids": [
            "DPC:E0001",
            "DPC:E0002",
            "APC::R0007"
          ],
          "when": "Si delimita la trattazione o si distribuiscono contenuti fra passaggi successivi."
        }
      ]
    },
    {
      "activation": "Attivare una singola regola soltanto se il suo oggetto è effettivamente trattato. Queste restrizioni prevalgono sulla lettura più ampia dei principi P02 e P03; non richiedono di inserire tali temi nel testo.",
      "device_ids": [
        "D03"
      ],
      "guardrail_ids": [
        "G03",
        "G04",
        "G05",
        "G10"
      ],
      "id": "C04",
      "label": "Ambiti circoscritti da non generalizzare",
      "principle_ids": [
        "P02",
        "P03"
      ],
      "rules": [
        {
          "instruction": "Distinguere ciò che rende visibile, ciò che non fornisce rispetto alla soluzione analitica e i limiti pertinenti della visualizzazione. Non ricavarne una preferenza generale per il visuale o la superiorità delle immagini.",
          "source_pattern_ids": [
            "EPC:T0008"
          ],
          "when": "Si presenta il ritratto di fase come strumento di comprensione."
        },
        {
          "instruction": "Distinguere incompletezza dei dati cartografici e latenza meteo, esplicitandone le conseguenze pratiche pertinenti. Non estendere questo specifico pattern a ogni dato o modello; non elencare limiti tautologici o lapalissiani.",
          "source_pattern_ids": [
            "EPC:T0010"
          ],
          "when": "Si descrivono il modello di illuminazione e i suoi dati di ingresso."
        },
        {
          "instruction": "Usare analogie strutturali fra domini solo con corrispondenze delimitate. Non sono identità o prove del modello; non obbligano a riusare DNA o organizzazioni militari. Il sostegno monoarticolo e l'applicabilità circoscritta non si ampliano per il solo fascino dichiarato dei sistemi connessi.",
          "source_pattern_ids": [
            "APC::R0006"
          ],
          "when": "Si spiegano unità combinatorie o aggregazione gerarchica nelle reti sociali."
        },
        {
          "instruction": "Precisare che cosa non si trasferisce fra i quadri, senza smentire in generale la fisica classica o creare sorpresa artificiosa. Non trasferire automaticamente il dispositivo ad altri confronti fra teorie.",
          "source_pattern_ids": [
            "APC::R0008"
          ],
          "when": "Si confrontano proprietà o attese classiche e comportamento quantistico nella logica o nella misura."
        }
      ]
    }
  ],
  "devices": [
    {
      "guardrail_ids": [
        "G01",
        "G02"
      ],
      "id": "D01",
      "instruction": "Formulare una domanda che il passo successivo affronta concretamente. È una risorsa frequente del registro, non un motivo per interrogare ogni paragrafo.",
      "label": "Domanda-cerniera",
      "principle_ids": [
        "P06"
      ],
      "source_pattern_ids": [
        "APC::R0003"
      ],
      "when": "Uno snodo richiede di chiarire un'applicazione, una spiegazione, una diagnosi o un nuovo compito."
    },
    {
      "guardrail_ids": [
        "G01",
        "G04",
        "G09"
      ],
      "id": "D02",
      "instruction": "Scegliere il dispositivo adatto: scenario con condizioni pertinenti oppure calcolo con valori e unità espliciti. I due usi non sono equivalenti; lo scenario è privilegiato nella divulgazione e meno nei tutorial. I numeri illustrativi non sono dati misurati né validazione generale del modello.",
      "label": "Scenario o caso numerico",
      "principle_ids": [
        "P04"
      ],
      "source_pattern_ids": [
        "APC::R0010",
        "APC::R0012"
      ],
      "when": "Un sistema ipotetico aiuta a impostare il ragionamento oppure valori determinati chiariscono un'operazione."
    },
    {
      "guardrail_ids": [
        "G01",
        "G04",
        "G10"
      ],
      "id": "D03",